{
  "$schema": "http://json-schema.org/draft-07/schema#",
  "$id": "structure-map.schema.json",
  "title": "FHIR StructureMap Schema",
  "description": "Schema for validating FHIR StructureMap resources",
  "type": "object",
  "properties": {
    "resourceType": {
      "type": "string",
      "const": "StructureMap"
    },
    "id": {
      "type": "string",
      "pattern": "^[A-Za-z0-9\\-\\.]{1,64}$"
    },
    "url": {
      "type": "string",
      "format": "uri"
    },
    "name": {
      "type": "string",
      "minLength": 1
    },
    "title": {
      "type": "string"
    },
    "status": {
      "type": "string",
      "enum": ["draft", "active", "retired", "unknown"]
    },
    "experimental": {
      "type": "boolean"
    },
    "description": {
      "type": "string"
    },
    "group": {
      "type": "array",
      "items": {
        "$ref": "#/definitions/StructureMapGroup"
      },
      "minItems": 1
    }
  },
  "required": ["resourceType", "group"],
  "additionalProperties": true,
  "definitions": {
    "StructureMapGroup": {
      "type": "object",
      "properties": {
        "name": {
          "type": "string",
          "minLength": 1
        },
        "typeMode": {
          "type": "string",
          "enum": ["none", "types", "type-and-types"]
        },
        "documentation": {
          "type": "string"
        },
        "input": {
          "type": "array",
          "items": {
            "$ref": "#/definitions/StructureMapGroupInput"
          }
        },
        "rule": {
          "type": "array",
          "items": {
            "$ref": "#/definitions/StructureMapGroupRule"
          }
        }
      },
      "required": ["name", "input"],
      "additionalProperties": true
    },
    "StructureMapGroupInput": {
      "type": "object",
      "properties": {
        "name": {
          "type": "string",
          "minLength": 1
        },
        "type": {
          "type": "string"
        },
        "mode": {
          "type": "string",
          "enum": ["source", "target"]
        },
        "documentation": {
          "type": "string"
        }
      },
      "required": ["name", "mode"],
      "additionalProperties": true
    },
    "StructureMapGroupRule": {
      "type": "object",
      "properties": {
        "name": {
          "type": "string"
        },
        "source": {
          "type": "array",
          "items": {
            "$ref": "#/definitions/StructureMapGroupRuleSource"
          },
          "minItems": 1
        },
        "target": {
          "type": "array",
          "items": {
            "$ref": "#/definitions/StructureMapGroupRuleTarget"
          }
        },
        "documentation": {
          "type": "string"
        }
      },
      "required": ["source"],
      "additionalProperties": true
    },
    "StructureMapGroupRuleSource": {
      "type": "object",
      "properties": {
        "context": {
          "type": "string",
          "minLength": 1
        },
        "element": {
          "type": "string"
        },
        "variable": {
          "type": "string"
        },
        "type": {
          "type": "string"
        },
        "min": {
          "type": "integer",
          "minimum": 0
        },
        "max": {
          "type": "string"
        }
      },
      "required": ["context"],
      "additionalProperties": true
    },
    "StructureMapGroupRuleTarget": {
      "type": "object",
      "properties": {
        "context": {
          "type": "string"
        },
        "contextType": {
          "type": "string",
          "enum": ["variable", "type"]
        }
      },
      "additionalProperties": true
    }
  }
}