{
  "resourceType": "StructureMap",
  "id": "test-map",
  "url": "http://example.org/StructureMap/test",
  "name": "TestMap",
  "status": "active",
  "group": [
    {
      "name": "main",
      "input": [
        {
          "name": "source",
          "mode": "source"
        },
        {
          "name": "target", 
          "mode": "target"
        }
      ],
      "rule": [
        {
          "source": [
            {
              "context": "source",
              "element": "name"
            }
          ],
          "target": [
            {
              "context": "target",
              "element": "fullName"
            }
          ]
        }
      ]
    }
  ]
}